[
  {
    "post_id": "tw-20260720-001",
    "platform": "twitter",
    "author_id": "twuser_1001",
    "author_handle": "@ahmedabad_news24",
    "text": "ગુજરાતમાં કોમી તણાવની ગંભીર ઘટના. પોલીસ મૌન છે. લોકો ડરી ગયા છે. શું થઈ રહ્યું છે અમદાવાદમાં? #AhmedabadAlert #GujaratNews",
    "language_hint": "gu",
    "created_at": "2026-07-20T10:15:00Z",
    "geo_location": {
      "lat": 23.0225,
      "lng": 72.5714,
      "place_name": "Ahmedabad, Gujarat"
    },
    "hashtags": ["AhmedabadAlert", "GujaratNews"],
    "mentions": [],
    "media_urls": [],
    "engagement_counts": { "likes": 342, "shares": 156, "comments": 89 },
    "raw_payload": {
      "account_created_at": "2019-03-15T00:00:00Z",
      "follower_count": 12500,
      "following_count": 890,
      "post_count": 4520
    }
  },
  {
    "post_id": "tw-20260720-002",
    "platform": "twitter",
    "author_id": "twuser_1002",
    "author_handle": "@rajkot_citizen",
    "text": "રાજકોટમાં નવી હોસ્પિટલ ખુલી. સરકારે આરોગ્ય સેવાઓ સુધારવા માટે સારું પગલું ભર્યું. #HealthcareGujarat",
    "language_hint": "gu",
    "created_at": "2026-07-20T11:30:00Z",
    "geo_location": {
      "lat": 22.3039,
      "lng": 70.8022,
      "place_name": "Rajkot, Gujarat"
    },
    "hashtags": ["HealthcareGujarat"],
    "mentions": [],
    "media_urls": [],
    "engagement_counts": { "likes": 89, "shares": 23, "comments": 12 },
    "raw_payload": {
      "account_created_at": "2020-06-10T00:00:00Z",
      "follower_count": 3400,
      "following_count": 520,
      "post_count": 1890
    }
  },
  {
    "post_id": "ig-20260720-003",
    "platform": "instagram",
    "author_id": "iguser_2001",
    "author_handle": "@surat_vibes",
    "text": "સુરતમાં ધાર્મિક સ્થળ પર હુમલો થયો એવી અફવા ફેલાઈ રહી છે!!! કોઈ CONFIRM કરો!!! URGENT!!! ફેલાવો બધાને!!! #SuratAttack #BREAKING",
    "language_hint": "gu",
    "created_at": "2026-07-20T14:00:00Z",
    "geo_location": {
      "lat": 21.1702,
      "lng": 72.8311,
      "place_name": "Surat, Gujarat"
    },
    "hashtags": ["SuratAttack", "BREAKING"],
    "mentions": [],
    "media_urls": ["https://example.com/images/surat_fake_1.jpg"],
    "engagement_counts": { "likes": 1200, "shares": 890, "comments": 456 },
    "raw_payload": {
      "account_created_at": "2026-07-01T00:00:00Z",
      "follower_count": 45,
      "following_count": 1200,
      "post_count": 340
    }
  },
  {
    "post_id": "tw-20260720-004",
    "platform": "twitter",
    "author_id": "twuser_1003",
    "author_handle": "@vadodara_updates",
    "text": "વડોદરામાં શાંતિ માર્ચ યોજાયો. તમામ સમુદાયના લોકો સાથે આવ્યા. એકતાનો સુંદર સંદેશ. #VadodaraPeace #Unity",
    "language_hint": "gu",
    "created_at": "2026-07-20T09:00:00Z",
    "geo_location": {
      "lat": 22.3072,
      "lng": 73.1812,
      "place_name": "Vadodara, Gujarat"
    },
    "hashtags": ["VadodaraPeace", "Unity"],
    "mentions": [],
    "media_urls": [],
    "engagement_counts": { "likes": 567, "shares": 234, "comments": 78 },
    "raw_payload": {
      "account_created_at": "2018-01-20T00:00:00Z",
      "follower_count": 8900,
      "following_count": 450,
      "post_count": 6700
    }
  },
  {
    "post_id": "fb-20260720-005",
    "platform": "facebook",
    "author_id": "fbuser_3001",
    "author_handle": "ગુજરાત_સમાચાર_પેજ",
    "text": "ગાંધીનગરમાં એક ચોક્કસ સમુદાયના લોકો પર હુમલો. તેઓને બહાર કાઢો! આ લોકો અમારા વિસ્તારમાં નથી જોઈતા! #Gandhinagar",
    "language_hint": "gu",
    "created_at": "2026-07-20T16:45:00Z",
    "geo_location": {
      "lat": 23.2156,
      "lng": 72.6369,
      "place_name": "Gandhinagar, Gujarat"
    },
    "hashtags": ["Gandhinagar"],
    "mentions": [],
    "media_urls": [],
    "engagement_counts": { "likes": 890, "shares": 567, "comments": 234 },
    "raw_payload": {
      "account_created_at": "2021-08-10T00:00:00Z",
      "follower_count": 15000,
      "following_count": 200,
      "post_count": 3200
    }
  },
  {
    "post_id": "tw-20260720-006",
    "platform": "twitter",
    "author_id": "twuser_1004",
    "author_handle": "@junagadh_local",
    "text": "જૂનાગઢમાં ગીર ફોરેસ્ટ પાસે સિંહ દેખાયો. વન વિભાગે સલામતી ચેતવણી જાહેર કરી. #GirLion #WildlifeGujarat",
    "language_hint": "gu",
    "created_at": "2026-07-20T07:30:00Z",
    "geo_location": {
      "lat": 21.5222,
      "lng": 70.4579,
      "place_name": "Junagadh, Gujarat"
    },
    "hashtags": ["GirLion", "WildlifeGujarat"],
    "mentions": [],
    "media_urls": ["https://example.com/images/gir_lion.jpg"],
    "engagement_counts": { "likes": 1500, "shares": 678, "comments": 190 },
    "raw_payload": {
      "account_created_at": "2017-11-05T00:00:00Z",
      "follower_count": 22000,
      "following_count": 340,
      "post_count": 9800
    }
  },
  {
    "post_id": "yt-20260720-007",
    "platform": "youtube",
    "author_id": "ytuser_4001",
    "author_handle": "@bhavnagar_talks",
    "text": "ભાવનગરમાં સ્થાનિક ઉદ્યોગપતિએ 500 લોકોને રોજગાર આપ્યો. ખૂબ જ પ્રેરણાદાયી વાર્તા. #BhavnagarJobs",
    "language_hint": "gu",
    "created_at": "2026-07-20T12:00:00Z",
    "geo_location": {
      "lat": 21.7645,
      "lng": 72.1519,
      "place_name": "Bhavnagar, Gujarat"
    },
    "hashtags": ["BhavnagarJobs"],
    "mentions": [],
    "media_urls": ["https://youtube.com/watch?v=example_bh1"],
    "engagement_counts": { "likes": 2300, "shares": 890, "comments": 345 },
    "raw_payload": {
      "account_created_at": "2016-05-20T00:00:00Z",
      "follower_count": 45000,
      "following_count": 120,
      "post_count": 780
    }
  },
  {
    "post_id": "tw-20260720-008",
    "platform": "twitter",
    "author_id": "twuser_1005",
    "author_handle": "@delhi_pulse",
    "text": "दिल्ली में आज सड़कों पर भारी ट्रैफिक. मेट्रो ले लो भाइयों. #DelhiTraffic #DailyCommute",
    "language_hint": "hi",
    "created_at": "2026-07-20T08:00:00Z",
    "geo_location": {
      "lat": 28.7041,
      "lng": 77.1025,
      "place_name": "New Delhi, Delhi"
    },
    "hashtags": ["DelhiTraffic", "DailyCommute"],
    "mentions": [],
    "media_urls": [],
    "engagement_counts": { "likes": 234, "shares": 56, "comments": 89 },
    "raw_payload": {
      "account_created_at": "2020-02-14T00:00:00Z",
      "follower_count": 5600,
      "following_count": 1200,
      "post_count": 3400
    }
  },
  {
    "post_id": "fb-20260720-009",
    "platform": "facebook",
    "author_id": "fbuser_3002",
    "author_handle": "मुंबई_न्यूज़_हब",
    "text": "BREAKING: मुंबई में पानी में ज़हर मिलाया गया है!!! सरकार छुपा रही है!!! अभी शेयर करो सबको बताओ!!! लाखों लोग ख़तरे में!!! #MumbaiWaterPoisoned #URGENT",
    "language_hint": "hi",
    "created_at": "2026-07-20T13:30:00Z",
    "geo_location": {
      "lat": 19.076,
      "lng": 72.8777,
      "place_name": "Mumbai, Maharashtra"
    },
    "hashtags": ["MumbaiWaterPoisoned", "URGENT"],
    "mentions": [],
    "media_urls": ["https://example.com/images/fake_water_report.jpg"],
    "engagement_counts": { "likes": 4500, "shares": 3200, "comments": 1200 },
    "raw_payload": {
      "account_created_at": "2026-06-25T00:00:00Z",
      "follower_count": 23,
      "following_count": 980,
      "post_count": 567
    }
  },
  {
    "post_id": "ig-20260720-010",
    "platform": "instagram",
    "author_id": "iguser_2002",
    "author_handle": "@lucknow_diaries",
    "text": "लखनऊ की बिरयानी खाई क्या? टुंडे कबाब और बिरयानी — बेस्ट कॉम्बो! #LucknowFood #Foodie",
    "language_hint": "hi",
    "created_at": "2026-07-20T18:00:00Z",
    "geo_location": {
      "lat": 26.8467,
      "lng": 80.9462,
      "place_name": "Lucknow, UP"
    },
    "hashtags": ["LucknowFood", "Foodie"],
    "mentions": [],
    "media_urls": ["https://example.com/images/biryani.jpg"],
    "engagement_counts": { "likes": 6700, "shares": 1200, "comments": 890 },
    "raw_payload": {
      "account_created_at": "2019-09-01T00:00:00Z",
      "follower_count": 34000,
      "following_count": 560,
      "post_count": 2100
    }
  },
  {
    "post_id": "tw-20260720-011",
    "platform": "twitter",
    "author_id": "twuser_1006",
    "author_handle": "@jaipur_watchdog",
    "text": "जयपुर में एक समुदाय विशेष के लोग इलाके पर कब्ज़ा कर रहे हैं. ये देश को बर्बाद कर देंगे. इनको रोकना ज़रूरी है. हिंदुओं जागो! #JaipurAlert #Hindutva",
    "language_hint": "hi",
    "created_at": "2026-07-20T15:00:00Z",
    "geo_location": {
      "lat": 26.9124,
      "lng": 75.7873,
      "place_name": "Jaipur, Rajasthan"
    },
    "hashtags": ["JaipurAlert", "Hindutva"],
    "mentions": [],
    "media_urls": [],
    "engagement_counts": { "likes": 1800, "shares": 1200, "comments": 567 },
    "raw_payload": {
      "account_created_at": "2022-01-01T00:00:00Z",
      "follower_count": 7800,
      "following_count": 2300,
      "post_count": 5600
    }
  },
  {
    "post_id": "tw-20260720-012",
    "platform": "twitter",
    "author_id": "twuser_1007",
    "author_handle": "@varanasi_heritage",
    "text": "वाराणसी के घाटों की सुबह की सुंदर तस्वीरें. गंगा आरती का अद्भुत नज़ारा. #VaranasiVibes #IncredibleIndia",
    "language_hint": "hi",
    "created_at": "2026-07-20T06:00:00Z",
    "geo_location": {
      "lat": 25.3176,
      "lng": 82.9739,
      "place_name": "Varanasi, UP"
    },
    "hashtags": ["VaranasiVibes", "IncredibleIndia"],
    "mentions": [],
    "media_urls": ["https://example.com/images/varanasi_ghat.jpg"],
    "engagement_counts": { "likes": 12000, "shares": 3400, "comments": 890 },
    "raw_payload": {
      "account_created_at": "2015-08-15T00:00:00Z",
      "follower_count": 89000,
      "following_count": 230,
      "post_count": 12000
    }
  },
  {
    "post_id": "fb-20260720-013",
    "platform": "facebook",
    "author_id": "fbuser_3003",
    "author_handle": "भोपाल_जनता",
    "text": "भोपाल में सरकारी अधिकारी भ्रष्ट हैं. नया पुल बनने में 5 साल लग गए. जनता परेशान. #BhopalCorruption #BadGovernance",
    "language_hint": "hi",
    "created_at": "2026-07-20T10:00:00Z",
    "geo_location": {
      "lat": 23.2599,
      "lng": 77.4126,